DateTime,Tweets,clean_tweet,polarity,subjectivity,sentiment_score
2023-05-31 08:43:17,b'Which are the best stocks for long term? 2023 #stocks #reliance #infosys #hdfc #tcs',Which best stocks long term stocks reliance infosys hdfc,0.475,0.35,0.16624999999999998
2023-05-31 08:39:06,b'RT @beingakash26_: #REL #RELIANCE BOOOOM\n \nSHORTED AT 2496.10\nLOW MADE SO FAR 2478\nLOT SIZE 250\n\n#HADC #INDICATOR\n\n#nifty #nifty50 #banknif\xe2\x80\xa6',RELIANCE BOOOOM nSHORTED nLOW MADE nLOT SIZE HADC INDICATOR nifty nifty banknif,0.0,0.0,0.0
2023-05-31 08:37:06,"b'#ManappuramFin   \xf0\x9f\x87\xae\xf0\x9f\x87\xb3 on the #NSE, #Block of 627792 shares at Rs. 110.15 worth 6.92 crore rupees at  1:58 PM\xe2\x80\xa6 https://t.co/HDl8HKQbo7'",ManappuramFin Block shares worth crore rupees https HKQbo,0.3,0.1,0.03
2023-05-31 08:31:56,b'\xf0\x9f\x91\x89 *Reliance*\n\xf0\x9f\xa5\xb3 2nd Target Achieved;\n\xf0\x9f\xaa\x82 High: 2492.85;\n#Reliance #RIL\n#ContextualizePb\nhttps://t.co/TX0JwzQGrH\xe2\x80\xa6 https://t.co/5p5RrfL6Uz',Reliance Target Achieved High Reliance ContextualizePb nhttps JwzQGrH https RrfL,0.16,0.5399999999999999,0.08639999999999999
2023-05-31 08:30:25,b'\xf0\x9f\x91\x89 Reliance\n\xf0\x9f\xa5\xb3 1st Target Achieved;\n\xf0\x9f\xaa\x82 High: 2489;\n \n#Reliance #RIL\n#ContextualizePb  \nhttps://t.co/TX0JwzQGrH\xe2\x80\xa6 https://t.co/4Rlg9Z8rjm',Reliance Target Achieved High Reliance ContextualizePb nhttps JwzQGrH https,0.16,0.5399999999999999,0.08639999999999999
2023-05-31 08:28:19,b'#REL #RELIANCE BOOOOM\n \nSHORTED AT 2496.10\nLOW MADE SO FAR 2478\nLOT SIZE 250\n\n#HADC #INDICATOR\n\n#nifty #nifty50\xe2\x80\xa6 https://t.co/rL0zFrUTeW',RELIANCE BOOOOM nSHORTED nLOW MADE nLOT SIZE HADC INDICATOR nifty nifty https zFrUTeW,0.0,0.0,0.0
2023-05-31 08:26:04,"b""Added 'Sobha Limited' to #portfolio. That will be the third from Realty along with Godrej Prop &amp; Mahindra Life.\n- S\xe2\x80\xa6 https://t.co/7YACVJGxZV""",Added Sobha Limited portfolio That will third from Realty along with Godrej Prop Mahindra Life https YACVJGxZV,-0.03571428571428571,0.07142857142857142,-0.002551020408163265
2023-05-31 08:15:35,"b'To read the full article, visit https://t.co/ts704MMNhF!\n\n#indianschools #news #newsupdate #newspaper #dailynews\xe2\x80\xa6 https://t.co/Yz0JJgtj85'",read full article visit https MMNhF indianschools news newsupdate newspaper dailynews https JJgtj,0.35,0.55,0.1925
2023-05-31 07:51:24,b'RT @nooreshtech: #Nifty down 140 points. \n\n#HDFCtwins impact 50. #Reliance 28 \n\nLast 30 mins will see volumes due to #MSCI rejig and last d\xe2\x80\xa6',Nifty down points HDFCtwins impact Reliance nLast mins will volumes MSCI rejig last,-0.07777777777777779,0.17777777777777778,-0.013827160493827163
2023-05-31 07:50:52,b'#Nifty down 140 points. \n\n#HDFCtwins impact 50. #Reliance 28 \n\nLast 30 mins will see volumes due to #MSCI rejig and\xe2\x80\xa6 https://t.co/0NUsBP37J4',Nifty down points HDFCtwins impact Reliance nLast mins will volumes MSCI rejig https NUsBP,-0.15555555555555559,0.2888888888888889,-0.04493827160493828
2023-05-31 07:48:38,b'RT @Finance_Bareek: Daily highlights on #tax #Finance and #economy on your feed. Visit our website https://t.co/8ci6JJ8DjT for more updates\xe2\x80\xa6',Daily highlights Finance economy your feed Visit website https more updates,0.25,0.25,0.0625
2023-05-31 07:46:22,b'When manager gets to know you are bitching him back.\n\xf0\x9f\x98\x82\xf0\x9f\x98\x82\xf0\x9f\x98\x82\xf0\x9f\x98\x82\n#Memes #MemeSeason2023 #memesdaily #jobmeme #hrmemes\xe2\x80\xa6 https://t.co/8pape6ArlC',When manager gets know bitching back Memes MemeSeason memesdaily jobmeme hrmemes https pape ArlC,0.0,0.0,0.0
2023-05-31 07:41:07,b'Daily highlights on #tax #Finance and #economy on your feed. Visit our website https://t.co/8ci6JJ8DjT for more upd\xe2\x80\xa6 https://t.co/wDYWkNhbyD',Daily highlights Finance economy your feed Visit website https more https wDYWkNhbyD,0.25,0.25,0.0625
2023-05-31 07:36:23,b'U23 Inter District tournament (Multi Day) 2023/24.\nCBCA were declared Champions and Combined district were\xc2\xa0runners\xc2\xa0\xe2\x80\xa6 https://t.co/zNrnR8kS8z',Inter District tournament Multi nCBCA were declared Champions Combined district were runners https zNrnR,0.0,0.0,0.0
2023-05-31 07:36:11,b'#RELIANCE \nRestesting???? https://t.co/cCpdTWRTAn',RELIANCE nRestesting https cCpdTWRTAn,0.0,0.0,0.0
2023-05-31 07:21:23,b'#Reliance stock after hitting first tgt level view negated at cost that is 2490 . cmp 2483',Reliance stock after hitting first level view negated cost that,0.25,0.3333333333333333,0.08333333333333333
2023-05-31 07:20:03,b'RT @EagleEyeReview: Tchinical Analisys Update #31May2023 09:37\nStock : #RELIANCE\n1 Day RSI :74.46\n1 Day RSI Comment :Strong with Positive B\xe2\x80\xa6',Tchinical Analisys Update nStock RELIANCE Comment Strong with Positive,0.33030303030303027,0.6393939393939394,0.21119375573921026
2023-05-31 07:19:40,b'Tchinical Analisys Update #31May2023 09:37\nStock : #RELIANCE\n1 Day RSI :74.46\n1 Day RSI Comment :Strong with Positi\xe2\x80\xa6 https://t.co/UnwTYgIRhp',Tchinical Analisys Update nStock RELIANCE Comment Strong with Positi https UnwTYgIRhp,0.4333333333333333,0.7333333333333333,0.3177777777777777
2023-05-31 07:11:45,"b'\xf0\x9f\x91\x89 Buy Reliance @ 2482; \n\xf0\x9f\x9a\x82 Target 2488, 2492, 2505, 2520; \n\xe2\x9d\x8c Strict SL 2478; \n \n#Reliance #RIL\n#ContextualizePb\xe2\x80\xa6 https://t.co/OeoCMjOhMR'",Reliance Target Strict Reliance ContextualizePb https OeoCMjOhMR,0.0,0.0,0.0
2023-05-31 07:07:57,"b'After being expelled from India for almost three years, Shein is planning a significant comeback.\n\nTap to read more\xe2\x80\xa6 https://t.co/ed7Ja4Jvrx'",After being expelled from India almost three years Shein planning significant comeback nTap read more https Jvrx,0.4375,0.6875,0.30078125
2023-05-31 07:04:27,b'31st May Most Active Stocks In NSE\xf0\x9f\x93\x8a\n\n#sharemarket #trading #stockmarketindia #stockmarket #sharemarketupdates\xe2\x80\xa6 https://t.co/OAs4grzCWR',Most Active Stocks sharemarket trading stockmarketindia stockmarket sharemarketupdates https grzCWR,0.18333333333333335,0.55,0.10083333333333334
2023-05-31 06:56:05,"b'RT @karthickkumar17: 5. Using this strategy, both scalping &amp; positional trades can be done with peace of mind \n\n6. This strategy can be use\xe2\x80\xa6'",Using this strategy both scalping positional trades done with peace mind This strategy,0.0,0.0,0.0
2023-05-31 06:48:43,"b'5. Using this strategy, both scalping &amp; positional trades can be done with peace of mind \n\n6. This strategy can be\xe2\x80\xa6 https://t.co/UVee2Jgxfq'",Using this strategy both scalping positional trades done with peace mind This strategy https UVee Jgxfq,0.0,0.0,0.0
2023-05-31 06:42:23,"b'#KotakMahindra   \xf0\x9f\x87\xae\xf0\x9f\x87\xb3 on the #NSE, #Block of 202318 shares at Rs. 1972.5 worth 39.91 crore rupees at  12:01 PM\xe2\x80\xa6 https://t.co/hmXAXBp5Ga'",KotakMahindra Block shares worth crore rupees https hmXAXBp,0.3,0.1,0.03
2023-05-31 06:42:10,"b'#Reliance   \xf0\x9f\x87\xae\xf0\x9f\x87\xb3 on the #NSE, #Block of 29572 shares at Rs. 2481.1 worth 7.34 crore rupees at  11:59 AM  #blockdeal\xe2\x80\xa6 https://t.co/FleRYrRegh'",Reliance Block shares worth crore rupees blockdeal https FleRYrRegh,0.3,0.1,0.03
2023-05-31 06:42:10,b'Check out today &amp; enjoy amazing content on Sportvot App available on your JioStore via JioFiber plans.\n\n#Jio\xe2\x80\xa6 https://t.co/De5s7GQpR5',Check today enjoy amazing content Sportvot available your JioStore JioFiber plans https GQpR,0.4666666666666666,0.6,0.27999999999999997
2023-05-31 06:41:41,b'Check out today &amp; enjoy amazing content on Sportvot App available on your JioStore via JioFiber plans.\xe2\x80\xa6 https://t.co/hxwchLCCwz',Check today enjoy amazing content Sportvot available your JioStore JioFiber plans https hxwchLCCwz,0.4666666666666666,0.6,0.27999999999999997
2023-05-31 06:17:54,"b""Stepping Up for a Sustainable Future: ONGC's Bold \xe2\x82\xb91 Trillion Investment to Tackle Carbon Emissions.\n#ongc\xe2\x80\xa6 https://t.co/coasCuym3P""",Stepping Sustainable Future ONGC Bold Trillion Investment Tackle Carbon Emissions ongc https coasCuym,0.16666666666666666,0.3958333333333333,0.06597222222222221
2023-05-31 06:06:05,b'RT @ws_pathshala: 31st May NSE Stock Market Top Gainers\xf0\x9f\x93\x88 VS Top Losers\xf0\x9f\x93\x89\n\n#sharemarket #trading #stockmarketindia #stockmarket #wallstreetpa\xe2\x80\xa6',Stock Market Gainers Losers sharemarket trading stockmarketindia stockmarket wallstreetpa,-0.2,0.2,-0.04000000000000001
2023-05-31 05:58:06,b'31st May NSE Stock Market Top Gainers\xf0\x9f\x93\x88 VS Top Losers\xf0\x9f\x93\x89\n\n#sharemarket #trading #stockmarketindia #stockmarket\xe2\x80\xa6 https://t.co/hdqgcNPEYQ',Stock Market Gainers Losers sharemarket trading stockmarketindia stockmarket https hdqgcNPEYQ,-0.2,0.2,-0.04000000000000001
2023-05-31 05:56:33,"b'Stock Market LIVE Updates: Sensex breaks 370 points, Nifty below 18,550, SBI, ONGC, NTPC top losers\n\n#profinserv\xe2\x80\xa6 https://t.co/PXjrfdEXSe'",Stock Market LIVE Updates Sensex breaks points Nifty below ONGC NTPC losers profinserv https PXjrfdEXSe,-0.03181818181818183,0.35,-0.011136363636363639
2023-05-31 05:52:02,b'RT @StockGrove: \xf0\x9f\x93\x8dBuy #BankBaroda \n\nFuture @ 185.50\n\nTP : 188 / 191\n\nSL : 184\n\nTimeline : 4 - 9 days\n\n#stockmarkets #bank #banknifty #tradin\xe2\x80\xa6',dBuy BankBaroda nFuture nTimeline days stockmarkets bank banknifty tradin,0.0,0.0,0.0
2023-05-31 05:49:12,b'\xf0\x9f\x93\x8dBuy #BankBaroda \n\nFuture @ 185.50\n\nTP : 188 / 191\n\nSL : 184\n\nTimeline : 4 - 9 days\n\n#stockmarkets #bank #banknifty\xe2\x80\xa6 https://t.co/KOIyBovdw1',dBuy BankBaroda nFuture nTimeline days stockmarkets bank banknifty https KOIyBovdw,0.0,0.0,0.0
2023-05-31 05:40:08,b'Is it  the best services that is provided by one of the biggest network in India?\n\nAny answers \n@reliancejio\xe2\x80\xa6 https://t.co/zYdQuxCMg6',best services that provided biggest network India nAny answers https zYdQuxCMg,1.0,0.3,0.3
2023-05-31 05:30:51,"b""@JioMart @JioMart_Support @reliancejio What kind of bullshit are you guys playing with us?! First you don't deliver\xe2\x80\xa6 https://t.co/iJ8tkRhjjN""",Support What kind bullshit guys playing with First deliver https tkRhjjN,0.425,0.6166666666666667,0.26208333333333333
2023-05-31 05:26:11,b'@theonlyharsh19 #reliance may re-test 2450 and from there some picture will be cleared.',reliance test from there some picture will cleared,0.0,0.0,0.0
2023-05-31 05:26:05,b'RT @AnujShukla10_10: #dixon did 188 from 74..14000 per lot\n#mcdowell did 19.4 from 10..9400 per lot\n#reliance did 106 from 50..14000 per lo\xe2\x80\xa6',dixon from mcdowell from reliance from,0.0,0.0,0.0
2023-05-31 05:19:07,b'#dixon did 188 from 74..14000 per lot\n#mcdowell did 19.4 from 10..9400 per lot\n#reliance did 106 from 50..14000 per\xe2\x80\xa6 https://t.co/9Ew8Qhb6lE',dixon from mcdowell from reliance from https,0.0,0.0,0.0
2023-05-31 05:00:34,b'#Intra\n\n#RELIANCE cash cmp 2483-2484\n\nSupport 2472',Intra RELIANCE cash nSupport,0.0,0.0,0.0
2023-05-31 05:00:04,"b""#Reliance Industries is set to dominate the country's online fashion market with a comeback deal for #Shein. The pa\xe2\x80\xa6 https://t.co/rPXaLhJtRm""",Reliance Industries dominate country online fashion market with comeback deal Shein https rPXaLhJtRm,0.0,0.0,0.0
2023-05-31 04:57:47,b'#Reliance - 2480\n\nDid not hold 2530\n\nGaining 50 points https://t.co/ww7EFkoCbT https://t.co/8fBqWIpGOI',Reliance nDid hold nGaining points https EFkoCbT https fBqWIpGOI,0.0,0.0,0.0
2023-05-31 04:57:06,"b'#RELIANCE \nAlready told you, on bounce short is must.\n\nUnexpected slide will happen in coming months!'",RELIANCE nAlready told bounce short must nUnexpected slide will happen coming months,0.0,0.3,0.0
2023-05-31 04:55:03,b'3rd Target 223 also done \xf0\x9f\x91\x8d\xe2\x9c\x85\xe2\x9c\x85\xf0\x9f\x92\xaf\nHope you enjoyed the ride\n#investing #dbl #stockmarkets #stocktobuy #StockMarketindia\xe2\x80\xa6 https://t.co/0oEjVo5QTd',Target also done nHope enjoyed ride investing stockmarkets stocktobuy StockMarketindia https oEjVo,0.5,0.7,0.35
2023-05-31 04:54:11,"b'Stepping into the spotlight with boundless energy and determination, we present the stars of tomorrow! \nJoin us as\xe2\x80\xa6 https://t.co/AsavlZNynz'",Stepping into spotlight with boundless energy determination present stars tomorrow nJoin https AsavlZNynz,-0.1,0.35,-0.034999999999999996
2023-05-31 04:41:56,b'RT @Inv016: \xe2\x9c\x85Reliance and Hdfc top losers..putting pressure on Nifty\n\n#niftyOptions #OptionsTrading #NiftyIN #Reliance #hdfc',Reliance Hdfc losers putting pressure Nifty niftyOptions OptionsTrading NiftyIN Reliance hdfc,-0.2,0.2,-0.04000000000000001
2023-05-31 04:41:24,b'#Reliance 2488\n\n5 waves up looks complete. \nAre we are gonna see fall bhaiyaaa??? #analysis\n@nishkumar1977 \n\nJust f\xe2\x80\xa6 https://t.co/QummVoIq5L',Reliance waves looks complete nAre gonna fall bhaiyaaa analysis nJust https QummVoIq,0.1,0.4,0.04000000000000001
2023-05-31 04:39:27,b'Yesterday shared my view on reliance that correction might come &amp; Bang on #Reliance #niftyOptions #OptionsTrading\xe2\x80\xa6 https://t.co/6YKrIFa7jp',Yesterday shared view reliance that correction might come Bang Reliance niftyOptions OptionsTrading https YKrIFa,0.0,0.0,0.0
2023-05-31 04:26:36,b'Still holding true #reliance #nifty https://t.co/eKRGUNwU8r',Still holding true reliance nifty https eKRGUNwU,0.35,0.65,0.22749999999999998
2023-05-31 04:24:50,b'Why I booked &amp; exited....to avoid #goosebumps....\n\n#Reliance https://t.co/VzU7fDFGGT',booked exited avoid goosebumps Reliance https fDFGGT,0.0,0.0,0.0
2023-05-31 04:22:07,"b'#RELIANCE - Reliance Industries Limited\n\nTrading now at 2487.80.  \n\nDay High is 2,509.85\n\nnow trading 2490 below.... https://t.co/Mh8ABy5igi'",RELIANCE Reliance Industries Limited nTrading nDay High nnow trading below https,0.04428571428571429,0.3414285714285714,0.015120408163265306
2023-05-31 04:21:29,b'\xe2\x9c\x85Reliance and Hdfc top losers..putting pressure on Nifty\n\n#niftyOptions #OptionsTrading #NiftyIN #Reliance #hdfc',Reliance Hdfc losers putting pressure Nifty niftyOptions OptionsTrading NiftyIN Reliance hdfc,-0.2,0.2,-0.04000000000000001
2023-05-31 04:21:28,b'#Reliance #update \nDone...\nWhat else you want...\nPerfect move going on with the levels...\n@PhoenixHarmonic\xe2\x80\xa6 https://t.co/e8EgraNebX',Reliance update nDone nWhat else want nPerfect move going with levels https EgraNebX,0.0,0.0,0.0
2023-05-31 04:05:28,"b'#SBI   \xf0\x9f\x87\xae\xf0\x9f\x87\xb3 on the #NSE, #Block of 86724 shares at Rs. 580.5 worth 5.03 crore rupees at  9:20 AM  #blockdeal\xe2\x80\xa6 https://t.co/7FUhbF12fC'",Block shares worth crore rupees blockdeal https FUhbF,0.3,0.1,0.03
2023-05-31 04:01:53,"b""#TradingSignals #priceactiontrading #nseindia #StockMarket #trading \n\n#nifty50 today's draggers'  banking stocks al\xe2\x80\xa6 https://t.co/fvG9T1HkFd""",TradingSignals priceactiontrading nseindia StockMarket trading nifty today draggers banking stocks https HkFd,0.0,0.0,0.0
2023-05-31 04:00:58,b'Daily Update #31May2023 09:30\nStock : #RELIANCE\nOPEN :2520.6\nHIGH :2537.7\nLOW :2514.35\nCLOSE :2519.95\nPreClose :252\xe2\x80\xa6 https://t.co/Jaek9uIPPX',Daily Update nStock RELIANCE nOPEN nHIGH nLOW nCLOSE nPreClose https Jaek uIPPX,0.0,0.0,0.0
2023-05-31 03:58:52,b'#RELIANCE #HDFCTWINS #LT\nAs expected sliding!',RELIANCE HDFCTWINS expected sliding,-0.1,0.4,-0.04000000000000001
2023-05-31 03:55:53,"b'#OptionChain - #RELIANCE\n#Stock #Bearish\n#PCR :0.7\nMax #CE buildup at 2500,windup at 2400 #PE buildup at 2600 windu\xe2\x80\xa6 https://t.co/O5YDU7PXsL'",OptionChain RELIANCE Stock Bearish nMax buildup windup buildup windu https PXsL,0.0,0.0,0.0
2023-05-31 03:44:00,"b""RT @OurYoganand: Mankind will never see an end of trouble until lovers of wisdom come to hold political power. Let's seek leaders who under\xe2\x80\xa6""",Mankind will never trouble until lovers wisdom come hold political power seek leaders under,0.05,0.15000000000000002,0.0075000000000000015
2023-05-31 03:43:12,b'RT @business_today: RIL Market Cap Zooms ToRs 17 Lakh Crore. Where Is The Stock Headed?\n\nWatch: https://t.co/xrLnIxkruy | #Reliance #Relian\xe2\x80\xa6',Market Zooms ToRs Lakh Crore Where Stock Headed nWatch https xrLnIxkruy Reliance Relian,0.0,0.0,0.0
2023-05-31 03:27:30,b'The sector leader (Ultratech) has been strong for a while &amp; other scrips (larger ones) led by Ramco Cement are brea\xe2\x80\xa6 https://t.co/jOiMKoyHHY',sector leader Ultratech been strong while other scrips larger ones Ramco Cement brea https jOiMKoyHHY,0.10277777777777776,0.5361111111111111,0.0551003086419753
2023-05-31 03:22:18,b'RT @IntelisysT: Mukesh Ambani backed EV maker Altigreen is said to weigh raising $85 million.\n.\n#mukeshambani #reliance #relianceindustries\xe2\x80\xa6',Mukesh Ambani backed maker Altigreen said weigh raising million mukeshambani reliance relianceindustries,0.0,0.0,0.0
2023-05-31 03:11:18,"b""RT @ETNOWlive: Market Alert | Here's Ambit's Nifty target and the major factors for the market \n\n#Nifty #Ambit #China #Reliance #metal http\xe2\x80\xa6""",Market Alert Here Ambit Nifty target major factors market Nifty Ambit China Reliance metal http,0.0625,0.5,0.03125
2023-05-31 03:03:37,b'#SGXNIFTY indicates a likely soft start. \n- The FII nos have been strong \xf0\x9f\x92\xaa again (+ 2000cr). \n- #Brent down 4%.\n- C\xe2\x80\xa6 https://t.co/FktngLG9Is',SGXNIFTY indicates likely soft start have been strong again Brent down https FktngLG,0.09444444444444444,0.5930555555555556,0.0560108024691358
2023-05-31 02:58:37,"b""Market Alert | Here's Ambit's Nifty target and the major factors for the market \n\n#Nifty #Ambit #China #Reliance\xe2\x80\xa6 https://t.co/Oyc2eNxBOJ""",Market Alert Here Ambit Nifty target major factors market Nifty Ambit China Reliance https eNxBOJ,0.0625,0.5,0.03125
2023-05-31 02:54:06,b'RT @StockInvesta: #Morning #Update\n\nGet update on Telegram https://t.co/ywKcLF6ZYe\n#StockMarket #banknifty #StocksToBuy #StockMarketIndia #\xe2\x80\xa6',Morning Update nGet update Telegram https ywKcLF StockMarket banknifty StocksToBuy StockMarketIndia,0.0,0.0,0.0
2023-05-31 02:53:50,b'RT @StockInvesta: #Morning #Update\n\nGet update on Telegram https://t.co/ywKcLF6ZYe\n#StockMarket #banknifty #StocksToBuy #StockMarketIndia #\xe2\x80\xa6',Morning Update nGet update Telegram https ywKcLF StockMarket banknifty StocksToBuy StockMarketIndia,0.0,0.0,0.0
2023-05-31 02:53:14,b'#Morning #Update\n\nGet update on Telegram https://t.co/ywKcLF6ZYe\n#StockMarket #banknifty #StocksToBuy\xe2\x80\xa6 https://t.co/VvK7KSe39j',Morning Update nGet update Telegram https ywKcLF StockMarket banknifty StocksToBuy https,0.0,0.0,0.0
2023-05-31 02:44:05,b'@trademonk7 Try to post #Reliance daily chart \nOctober 2022 to till date.',post Reliance daily chart nOctober till date,0.0,0.0,0.0
2023-05-31 02:28:13,"b""RT @5paisa: Portfolio Powerhouses: Reliance Group's Top 10 Stocks to Watch. \n\nFor more such #TradeBytes, stay tuned with 5paisa.\n\n#Kinetic\xe2\x80\xa6""",Portfolio Powerhouses Reliance Group Stocks Watch nFor more such TradeBytes stay tuned with paisa Kinetic,0.25,0.5,0.125
2023-05-31 02:12:08,b'RT @raghavwadhwa: Indian companies with Highest Profits\xf0\x9f\x92\xb8\xf0\x9f\x94\xa5\n\n\xf0\x9f\x8c\x9fTop of the list Reliance Industies with \xe2\x82\xb9 74000 Cr Net Profit \xf0\x9f\xab\xa1\xf0\x9f\x92\xab\n.\n.\n.\n.\n\n#Nift\xe2\x80\xa6',Indian companies with Highest Profits fTop list Reliance Industies with Profit Nift,0.0,0.0,0.0
2023-05-31 00:37:51,"b'RT @KgCalls: #Bharatforg shared on #telegram Rs 24,000 profit\n\nSearch #KGSTOCKMARKETCALLS ON #telegram \n\nLink \xf0\x9f\x91\x87\nhttps://t.co/mBjIm8zlwY\n\n#A\xe2\x80\xa6'",Bharatforg shared telegram profit nSearch KGSTOCKMARKETCALLS telegram nLink nhttps mBjIm zlwY,0.0,0.0,0.0
2023-05-31 00:29:47,b'RT @rajminpanchal: 5 Stocks W/ VOLUME BASE BUYING (Weekly)- RETWEET/FOLLOW\n\n#RELIANCE #ONGC #ZOMATO #BHEL #RBLBANK\n\n#stocks #StockMarket #S\xe2\x80\xa6',Stocks VOLUME BASE BUYING Weekly RETWEET FOLLOW RELIANCE ONGC ZOMATO BHEL RBLBANK stocks StockMarket,-0.8,1.0,-0.8
2023-05-30 22:08:46,"b'\xf0\x9f\x94\x94To access the full article, purchase a subscription that suits your needs.\n#Reliance #Smartgovernments\xe2\x80\xa6 https://t.co/mzAICXRBsH'",access full article purchase subscription that suits your needs Reliance Smartgovernments https mzAICXRBsH,0.35,0.55,0.1925
2023-05-30 20:30:20,b'#Reliance Industries. Cmp 2520. Huge resistance at 2550. Can fall to 2450 if does not stay above 2550. But eventual\xe2\x80\xa6 https://t.co/NkLldX2VNX',Reliance Industries Huge resistance fall does stay above eventual https NkLldX,0.20000000000000004,0.5,0.10000000000000002
2023-05-30 19:13:01,b'When is the #reliance demerger likely? Or is it even going to happen?',When reliance demerger likely even going happen,0.0,1.0,0.0
2023-05-30 18:32:18,b'RT @Urvashi57Sharma: #JioCinema breaks world record with over 3.21 crore viewers during #IPL2023Final #csk VS #GT. #mukeshambani #Reliance\xe2\x80\xa6',JioCinema breaks world record with over crore viewers during Final mukeshambani Reliance,0.0,1.0,0.0
2023-05-30 18:29:48,b'Check out my #RELIANCE analysis on @TradingView: https://t.co/jvUwQkgko8 \nstrong bullish https://t.co/J9585G7v4R',Check RELIANCE analysis https jvUwQkgko nstrong bullish https,0.0,0.0,0.0
2023-05-30 18:23:05,"b'RT @KgCalls: #Bharatforg shared on #telegram Rs 24,000 profit\n\nSearch #KGSTOCKMARKETCALLS ON #telegram \n\nLink \xf0\x9f\x91\x87\nhttps://t.co/mBjIm8zlwY\n\n#A\xe2\x80\xa6'",Bharatforg shared telegram profit nSearch KGSTOCKMARKETCALLS telegram nLink nhttps mBjIm zlwY,0.0,0.0,0.0
2023-05-30 18:12:52,b'RT @IntelisysT: Mukesh Ambani backed EV maker Altigreen is said to weigh raising $85 million.\n.\n#mukeshambani #reliance #relianceindustries\xe2\x80\xa6',Mukesh Ambani backed maker Altigreen said weigh raising million mukeshambani reliance relianceindustries,0.0,0.0,0.0
2023-05-30 18:04:16,"b'RT @KgCalls: #Bharatforg shared on #telegram Rs 24,000 profit\n\nSearch #KGSTOCKMARKETCALLS ON #telegram \n\nLink \xf0\x9f\x91\x87\nhttps://t.co/mBjIm8zlwY\n\n#A\xe2\x80\xa6'",Bharatforg shared telegram profit nSearch KGSTOCKMARKETCALLS telegram nLink nhttps mBjIm zlwY,0.0,0.0,0.0
2023-05-30 18:01:05,"b'#Bharatforg shared on #telegram Rs 24,000 profit\n\nSearch #KGSTOCKMARKETCALLS ON #telegram \n\nLink \xf0\x9f\x91\x87\xe2\x80\xa6 https://t.co/kf496Gj275'",Bharatforg shared telegram profit nSearch KGSTOCKMARKETCALLS telegram nLink https,0.0,0.0,0.0
2023-05-30 17:46:12,b'#crudeoil 6100pe 222 to 429 \xf0\x9f\x9a\x80\xf0\x9f\x9a\x80\xf0\x9f\x9a\x80\n\nJoin our FREE #stockmarket view #telegramchannel link in Bio\n\n #follow\xef\xbd\x8de\xe2\x80\xa6 https://t.co/M6bqSD5V03',crudeoil nJoin FREE stockmarket view telegramchannel link follow https bqSD,0.4,0.8,0.32000000000000006
2023-05-30 17:23:40,b'Date 30.5.2023\nAlembic Pharma (day chart)\n\n#apllltd #nifty50 #banknifty #Crypto #altcoin #dogecoin #Bitcoin  #crude\xe2\x80\xa6 https://t.co/1hnIMPNG5m',Date nAlembic Pharma chart apllltd nifty banknifty Crypto altcoin dogecoin Bitcoin crude https hnIMPNG,-0.7,1.0,-0.7
2023-05-30 16:59:34,b'RT @Urvashi57Sharma: #JioCinema breaks world record with over 3.21 crore viewers during #IPL2023Final #csk VS #GT. #mukeshambani #Reliance\xe2\x80\xa6',JioCinema breaks world record with over crore viewers during Final mukeshambani Reliance,0.0,1.0,0.0
2023-05-30 16:20:51,b'RT @Urvashi57Sharma: #JioCinema breaks world record with over 3.21 crore viewers during #IPL2023Final #csk VS #GT. #mukeshambani #Reliance\xe2\x80\xa6',JioCinema breaks world record with over crore viewers during Final mukeshambani Reliance,0.0,1.0,0.0
2023-05-30 16:14:01,b'RT @Urvashi57Sharma: #JioCinema breaks world record with over 3.21 crore viewers during #IPL2023Final #csk VS #GT. #mukeshambani #Reliance\xe2\x80\xa6',JioCinema breaks world record with over crore viewers during Final mukeshambani Reliance,0.0,1.0,0.0
2023-05-30 15:47:41,b'RT @TanaysinghT: Reliance Jio has crossed the 1 crore (10 mil) subscriber mark in Kolkata. It has 43% market share in the city. #jio #Relia\xe2\x80\xa6',Reliance crossed crore subscriber mark Kolkata market share city Relia,0.0,0.0,0.0
2023-05-30 15:38:44,"b'RT @invasset_: #Reliance Industries: NBC Universal (NBCU) and #JioCinema, #Viacom18\xe2\x80\x99s streaming service, have entered into a multi-year par\xe2\x80\xa6'",Reliance Industries Universal NBCU JioCinema Viacom streaming service have entered into multi year,0.0,0.0,0.0
2023-05-30 15:12:26,b'RT @raghavwadhwa: Indian companies with Highest Profits\xf0\x9f\x92\xb8\xf0\x9f\x94\xa5\n\n\xf0\x9f\x8c\x9fTop of the list Reliance Industies with \xe2\x82\xb9 74000 Cr Net Profit \xf0\x9f\xab\xa1\xf0\x9f\x92\xab\n.\n.\n.\n.\n\n#Nift\xe2\x80\xa6',Indian companies with Highest Profits fTop list Reliance Industies with Profit Nift,0.0,0.0,0.0
2023-05-30 15:05:11,"b""Status of earlier given calls \xf0\x9f\x91\x87 (PART 4)\n\n#BHARATFORG JUN 790CE, 21.95 to 27.5 \xf0\x9f\x92\xa5\xf0\x9f\x8e\x89 (Yesterday's BTST Call) , 5.5K Pr\xe2\x80\xa6 https://t.co/yXXSMjatpM""",Status earlier given calls PART BHARATFORG Yesterday BTST Call https yXXSMjatpM,0.0,0.5,0.0
2023-05-30 15:03:33,b'RT @Urvashi57Sharma: #JioCinema breaks world record with over 3.21 crore viewers during #IPL2023Final #csk VS #GT. #mukeshambani #Reliance\xe2\x80\xa6',JioCinema breaks world record with over crore viewers during Final mukeshambani Reliance,0.0,1.0,0.0
2023-05-30 14:57:03,b'RT @rajminpanchal: 5 Stocks W/ VOLUME BASE BUYING (Weekly)- RETWEET/FOLLOW\n\n#RELIANCE #ONGC #ZOMATO #BHEL #RBLBANK\n\n#stocks #StockMarket #S\xe2\x80\xa6',Stocks VOLUME BASE BUYING Weekly RETWEET FOLLOW RELIANCE ONGC ZOMATO BHEL RBLBANK stocks StockMarket,-0.8,1.0,-0.8
