DateTime,Tweets,clean_tweet,polarity,subjectivity,sentiment_score
2023-05-30 05:39:13,"b'RT @Velvet_Mamba: Unlike BNF, even in the retracement the RSI in nifty never turned bearish. Entry at candle close SL at BLR. 25 points don\xe2\x80\xa6'",Unlike even retracement nifty never turned bearish Entry candle close points,0.0,0.0,0.0
2023-05-30 05:13:43,"b'#KIMS   \xf0\x9f\x87\xae\xf0\x9f\x87\xb3 on the #NSE, #Block of 391366 shares at Rs. 1600 worth 62.62 crore rupees at  10:33 AM  #blockdeal\xe2\x80\xa6 https://t.co/F2cXsh4nH8'",KIMS Block shares worth crore rupees blockdeal https cXsh,0.3,0.1,0.03
2023-05-30 04:32:09,"b'#KotakBank   \xf0\x9f\x87\xae\xf0\x9f\x87\xb3 on the #NSE, #Block of 133395 shares at Rs. 1971.9 worth 26.3 crore rupees at  9:57 AM  #blockdeal #intraday #bigblock'",KotakBank Block shares worth crore rupees blockdeal intraday bigblock,0.3,0.1,0.03
2023-05-30 04:27:06,b'#KotakMahindraBank $KOTAKBANK Daily Chart\n#SuperTrend suggests #Bullish trend\n#Support level at 1916.92\xe2\x80\xa6 https://t.co/ubOUzTSBxw',KotakMahindraBank KOTAKBANK Daily Chart SuperTrend suggests Bullish trend Support level https ubOUzTSBxw,0.0,0.0,0.0
2023-05-30 04:22:43,b'#Kotakbank - looks hot on the charts\n\n#BREAKOUTSTOCKS #Nifty50 #BANKNIFTYFUTURE \n\n@nakulvibhor\n@kuttrapali26\xe2\x80\xa6 https://t.co/iAQSBtghnS',Kotakbank looks charts BREAKOUTSTOCKS Nifty BANKNIFTYFUTURE https iAQSBtghnS,0.0,0.0,0.0
2023-05-30 04:21:42,b'RT @Thekalal: #KOTAKBANK: 1990 breakout \n\nsupport 1900 as of now \n#bullish #stockmarket #stockstowatch #trading #investing #nse https://t.c\xe2\x80\xa6',KOTAKBANK breakout nsupport bullish stockmarket stockstowatch trading investing https,0.0,0.0,0.0
2023-05-30 04:21:32,b'#Kotakbank cmp 1974\n\nReady to fly \nkeep eyes \n\n#Equity #nifty #Banknifty\n#GAME_OF_TRENDLINES https://t.co/C5Rxaemeti https://t.co/qCM7HTn8s3',Kotakbank nReady nkeep eyes Equity nifty Banknifty GAME TRENDLINES https Rxaemeti https,-0.4,0.4,-0.16000000000000003
2023-05-30 04:18:57,b'#KotakMahindraBank $KOTAKBANK Daily #Stock Chart with 100 days #Fibonacci Retracement Levels\nFibonacci #Support Lev\xe2\x80\xa6 https://t.co/UHNNvg9H7l',KotakMahindraBank KOTAKBANK Daily Stock Chart with days Fibonacci Retracement Levels nFibonacci Support https UHNNvg,0.0,0.0,0.0
2023-05-30 04:02:37,"b'Unlike BNF, even in the retracement the RSI in nifty never turned bearish. Entry at candle close SL at BLR. 25 poin\xe2\x80\xa6 https://t.co/qCxRFKykPg'",Unlike even retracement nifty never turned bearish Entry candle close poin https qCxRFKykPg,0.0,0.0,0.0
2023-05-30 03:50:59,b'[Automated]\n#NSE #Nifty #Nifty50 #Shares as on 09:20\n\nGainers: 28 | Loosers: 22\n\nTop 3\n\nHCLTECH 1.24% \nKOTAKBANK 0.\xe2\x80\xa6 https://t.co/ESRVzRPDTz',Automated Nifty Nifty Shares nGainers Loosers nTop nHCLTECH nKOTAKBANK https ESRVzRPDTz,0.0,0.0,0.0
2023-05-30 03:45:04,b'Daily Update #30May2023 09:15\nStock : #KOTAKBANK\nOPEN :1963.1\nHIGH :1973.3\nLOW :1948.25\nCLOSE :1953.2\nPreClose :194\xe2\x80\xa6 https://t.co/LBV0CfRSNr',Daily Update nStock KOTAKBANK nOPEN nHIGH nLOW nCLOSE nPreClose https CfRSNr,0.0,0.0,0.0
2023-05-30 03:44:55,b'Daily Update #30May2023 09:14\nStock : #KOTAKBANK\nOPEN :1963.1\nHIGH :1973.3\nLOW :1948.25\nCLOSE :1953.2\nPreClose :194\xe2\x80\xa6 https://t.co/bJrUtznHnn',Daily Update nStock KOTAKBANK nOPEN nHIGH nLOW nCLOSE nPreClose https bJrUtznHnn,0.0,0.0,0.0
2023-05-29 23:26:19,"b'#OptionChain - #KOTAKBANK\n#Stock #Bearish\n#PCR :0.75\nMax #CE buildup at 1960,windup at 1920 #PE buildup at 1960 win\xe2\x80\xa6 https://t.co/VSFvewCdl9'",OptionChain KOTAKBANK Stock Bearish nMax buildup windup buildup https VSFvewCdl,0.0,0.0,0.0
2023-05-29 16:31:57,b'RT @NeelGarg12: Kotak Bank - Perfect Bounce from 1950 support area\n\nKotak Bank Jun 1960 CE at 42.90 now \n\xe2\x82\xb91850+ profit running per lot\n\nTRG\xe2\x80\xa6',Kotak Bank Perfect Bounce from support area nKotak Bank profit running nTRG,1.0,1.0,1.0
2023-05-29 16:11:32,b'RT @NeelGarg12: Kotak Bank - Perfect Bounce from 1950 support area\n\nKotak Bank Jun 1960 CE at 42.90 now \n\xe2\x82\xb91850+ profit running per lot\n\nTRG\xe2\x80\xa6',Kotak Bank Perfect Bounce from support area nKotak Bank profit running nTRG,1.0,1.0,1.0
2023-05-29 16:00:06,b'#KotakBank - 1953\n\nHigh made - 1974 https://t.co/jBGb8mf4HT https://t.co/X9PktsMv9P',KotakBank nHigh made https jBGb https PktsMv,0.0,0.0,0.0
2023-05-29 15:45:57,"b'RT @5paisa: A snapshot of the top 5 stocks in each industry segment. \n\nFor more such #TradeBytes, stay tuned with 5paisa.\n\n#Tradebyte #SBI\xe2\x80\xa6'",snapshot stocks each industry segment nFor more such TradeBytes stay tuned with paisa Tradebyte,0.25,0.5,0.125
2023-05-29 15:23:23,"b'RT @5paisa: A snapshot of the top 5 stocks in each industry segment. \n\nFor more such #TradeBytes, stay tuned with 5paisa.\n\n#Tradebyte #SBI\xe2\x80\xa6'",snapshot stocks each industry segment nFor more such TradeBytes stay tuned with paisa Tradebyte,0.25,0.5,0.125
2023-05-29 14:33:37,"b'@AlgoBoffin Exited full: tamo (ev exhaust), sbin, lt (adding deals but price sideways), kotakbank, airtel. Added ta\xe2\x80\xa6 https://t.co/XXZkvCjnOQ'",Exited full tamo exhaust sbin adding deals price sideways kotakbank airtel Added https XXZkvCjnOQ,0.35,0.55,0.1925
2023-05-29 12:52:40,"b""@KotakBankLtd very irresponsible employees since  20 days am asking for statement but employee didn't give us and 3\xe2\x80\xa6 https://t.co/QB6RAHu5Ds""",very irresponsible employees since days asking statement employee didn give https RAHu,0.2,0.3,0.06
2023-05-29 12:44:11,"b'#KotakMahindraBank $KOTAKBANK chart suggests #Fibonacci based #Resistance Levels are 1958.76,1960.74,1980.0\nand\xe2\x80\xa6 https://t.co/cR9Msd1yYd'",KotakMahindraBank KOTAKBANK chart suggests Fibonacci based Resistance Levels nand https,0.0,0.0,0.0
2023-05-29 12:44:11,b'#KotakMahindraBank $KOTAKBANK DailyChart-SMAandFibonacciSupport-Resistance\nStock trading above 200 #SMA\n20SMA at 19\xe2\x80\xa6 https://t.co/R0bvrNbGp5',KotakMahindraBank KOTAKBANK DailyChart SMAandFibonacciSupport Resistance nStock trading above https bvrNbGp,0.0,0.1,0.0
2023-05-29 11:42:48,"b'With Banknifty BO, This banking stock will play big roll..!\n#KOTAKBANK\n#ICICIBANK\n#INDUSINDBANK\n\n#nifty #banknifty\xe2\x80\xa6 https://t.co/A5C6l8TljY'",With Banknifty This banking stock will play roll KOTAKBANK ICICIBANK INDUSINDBANK nifty banknifty https TljY,0.0,0.0,0.0
2023-05-29 10:36:21,b'Tchinical Analisys Update #29May2023 13:51\nStock : #KOTAKBANK\n30 Min RSI :60.7\n30 Min RSI Comment :Strong with Nega\xe2\x80\xa6 https://t.co/nKWQVJZwp3',Tchinical Analisys Update nStock KOTAKBANK Comment Strong with Nega https nKWQVJZwp,0.4333333333333333,0.7333333333333333,0.3177777777777777
2023-05-29 10:36:11,b'Closing bell #nifty #nifty50 #NiftyBank #niftyoption #kotakbank #adani #AdaniEnterprises https://t.co/y6MZXmd18j',Closing bell nifty nifty NiftyBank niftyoption kotakbank adani AdaniEnterprises https MZXmd,0.0,0.0,0.0
2023-05-29 09:47:44,"b'Nifty marching towards life-time high in June. Which stocks should you buy? \n#KOTAKBANK | CMP INR 1,951 | 6.0% abov\xe2\x80\xa6 https://t.co/ojwWwrLuOe'",Nifty marching towards life time high June Which stocks should KOTAKBANK abov https ojwWwrLuOe,0.16,0.5399999999999999,0.08639999999999999
2023-05-29 09:20:43,b'#KotakMahindraBank $KOTAKBANK Last 36 months Daily #StockMovement Histogram #Chart\nMax downward movement was -6.07%\xe2\x80\xa6 https://t.co/noL1Kf2NS2',KotakMahindraBank KOTAKBANK Last months Daily StockMovement Histogram Chart nMax downward movement https,0.0,0.03333333333333333,0.0
2023-05-29 08:30:57,b'RT @NeelGarg12: Kotak Bank - Perfect Bounce from 1950 support area\n\nKotak Bank Jun 1960 CE at 42.90 now \n\xe2\x82\xb91850+ profit running per lot\n\nTRG\xe2\x80\xa6',Kotak Bank Perfect Bounce from support area nKotak Bank profit running nTRG,1.0,1.0,1.0
2023-05-29 08:19:07,b'RT @NeelGarg12: Kotak Bank - Perfect Bounce from 1950 support area\n\nKotak Bank Jun 1960 CE at 42.90 now \n\xe2\x82\xb91850+ profit running per lot\n\nTRG\xe2\x80\xa6',Kotak Bank Perfect Bounce from support area nKotak Bank profit running nTRG,1.0,1.0,1.0
2023-05-29 08:06:04,b'Kotak Bank - Perfect Bounce from 1950 support area\n\nKotak Bank Jun 1960 CE at 42.90 now \n\xe2\x82\xb91850+ profit running per\xe2\x80\xa6 https://t.co/NuFXwEe8mj',Kotak Bank Perfect Bounce from support area nKotak Bank profit running https NuFXwEe,1.0,1.0,1.0
2023-05-29 07:49:00,b'Alert Buy #KOTAKBANK CMP: 1959.85 #NimblrTA \n\nAlerts are delayed and for educational purpose only.\nFor live alerts\xe2\x80\xa6 https://t.co/Quwfy0kGge',Alert KOTAKBANK NimblrTA nAlerts delayed educational purpose only nFor live alerts https Quwfy kGge,0.12878787878787878,0.5833333333333334,0.07512626262626262
2023-05-29 07:14:05,b'RT @jp_bharati: https://t.co/FyimzSGTNw  \nKotakbank ready to breakout',https FyimzSGTNw nKotakbank ready breakout,0.2,0.5,0.1
2023-05-29 06:46:03,b'Tchinical Analisys Update #29May2023 10:00\nStock : #KOTAKBANK\n1 Day RSI :55.94\n1 Day RSI Comment :Strong with Posit\xe2\x80\xa6 https://t.co/w9KrEhPHYj',Tchinical Analisys Update nStock KOTAKBANK Comment Strong with Posit https KrEhPHYj,0.4333333333333333,0.7333333333333333,0.3177777777777777
2023-05-29 06:39:04,b'\xf0\x9f\x9f\xa9Intraday stock ::\n\nBuy kotak bank above 1956\nSL 1946\ntarget 1966 1974+\n\n#kotakbank #banknifty',Intraday stock nBuy kotak bank above ntarget kotakbank banknifty,0.0,0.1,0.0
2023-05-29 05:36:07,b'RT @CapitalTrends: #KOTAKBANK   forms #ThreeWeekTight pattern. #BULLISH   https://t.co/rPZnoSr0RT https://t.co/o6B3YfpAUe',KOTAKBANK forms ThreeWeekTight pattern BULLISH https rPZnoSr https YfpAUe,0.0,0.0,0.0
2023-05-29 05:33:27,b'RT @CapitalTrends: #KOTAKBANK   forms #ThreeWeekTight pattern. #BULLISH   https://t.co/rPZnoSr0RT https://t.co/o6B3YfpAUe',KOTAKBANK forms ThreeWeekTight pattern BULLISH https rPZnoSr https YfpAUe,0.0,0.0,0.0
2023-05-29 05:33:06,"b'#OptionChain - #KOTAKBANK\n#Stock #Bearish\n#PCR :0.76\nMax #CE buildup at 1980,windup at 1860 #PE buildup at 1960 win\xe2\x80\xa6 https://t.co/HYoWxK5ORP'",OptionChain KOTAKBANK Stock Bearish nMax buildup windup buildup https HYoWxK,0.0,0.0,0.0
2023-05-29 05:31:05,b'RT @CapitalTrends: #KOTAKBANK   forms #ThreeWeekTight pattern. #BULLISH   https://t.co/rPZnoSr0RT https://t.co/o6B3YfpAUe',KOTAKBANK forms ThreeWeekTight pattern BULLISH https rPZnoSr https YfpAUe,0.0,0.0,0.0
2023-05-29 04:52:58,b'Alert Sell #KOTAKBANK CMP: 1951.8 #NimblrTA \n\nAlerts are delayed and for educational purpose only.\nFor live alerts\xe2\x80\xa6 https://t.co/xQybT4GPwf',Alert Sell KOTAKBANK NimblrTA nAlerts delayed educational purpose only nFor live alerts https xQybT GPwf,0.12878787878787878,0.5833333333333334,0.07512626262626262
2023-05-29 04:35:42,b'RT @CapitalTrends: #KOTAKBANK   forms #ThreeWeekTight pattern. #BULLISH   https://t.co/rPZnoSr0RT https://t.co/o6B3YfpAUe',KOTAKBANK forms ThreeWeekTight pattern BULLISH https rPZnoSr https YfpAUe,0.0,0.0,0.0
2023-05-29 04:28:38,"b""#kotakbank a hole in the BULL's boat.""",kotakbank hole BULL boat,0.0,0.0,0.0
2023-05-29 04:22:19,b'#KotakMahindraBank $KOTAKBANK Monthwise Daily High - Low Movement Box Plot\nAvg day swing for last month is 32.25\nAv\xe2\x80\xa6 https://t.co/NiIRATga0o',KotakMahindraBank KOTAKBANK Monthwise Daily High Movement Plot nAvg swing last month https NiIRATga,0.05333333333333334,0.2022222222222222,0.010785185185185184
2023-05-29 04:13:39,b'Early Morning Update #29May2023 09:43\nStock : #KOTAKBANK\nOPEN :1949.95\nHIGH :1949.95\nLOW :1923.5\nCLOSE :1945.05\nPre\xe2\x80\xa6 https://t.co/RdaAAyWhnt',Early Morning Update nStock KOTAKBANK nOPEN nHIGH nLOW nCLOSE nPre https RdaAAyWhnt,0.1,0.3,0.03
2023-05-29 04:04:38,b'KOTAKBANK 1900 CE BUY ABOVE 87\nTARGET:91/96/103',KOTAKBANK ABOVE nTARGET,0.0,0.1,0.0
2023-05-29 04:01:24,b'3 Days View: Buy KotakBank Fut at 1968-1969 for 2020 SL below 1948',Days View KotakBank below,0.0,0.0,0.0
2023-05-29 03:57:05,b'#KotakMahindraBank $KOTAKBANK Daily #Stock Chart with 50 days #Fibonacci Retracement Levels\nFibonacci #Support Leve\xe2\x80\xa6 https://t.co/hpUnmYLjuE',KotakMahindraBank KOTAKBANK Daily Stock Chart with days Fibonacci Retracement Levels nFibonacci Support Leve https hpUnmYLjuE,0.0,0.0,0.0
2023-05-29 03:14:51,b'#KOTAKBANK   forms #ThreeWeekTight pattern. #BULLISH   https://t.co/rPZnoSr0RT https://t.co/o6B3YfpAUe',KOTAKBANK forms ThreeWeekTight pattern BULLISH https rPZnoSr https YfpAUe,0.0,0.0,0.0
2023-05-29 02:55:53,b'https://t.co/FyimzSGTNw  \nKotakbank ready to breakout',https FyimzSGTNw nKotakbank ready breakout,0.2,0.5,0.1
2023-05-28 16:39:39,"b'#options and stock level for May 29\n#Relianceindustries :CE if the price&gt;2509,PE if the price&lt;2416.05\n#KotakBank:CE\xe2\x80\xa6 https://t.co/IOz7PzuMvm'",options stock level Relianceindustries price price KotakBank https PzuMvm,0.0,0.0,0.0
2023-05-28 14:34:48,b'@KOTAKBANK_CARES @KOTAKBANKCares If Customer  Calling  For There Issues Then Why Your Executive  Force Them To Ugra\xe2\x80\xa6 https://t.co/Z6iLxdEjtJ',Customer Calling There Issues Then Your Executive Force Them Ugra https iLxdEjtJ,0.0,0.0,0.0
2023-05-28 12:40:02,b'RT @frozentrader: #kotakbank weekly chart demand supply zone for bulls &amp; bears can we see breakout this time by bulls keep eye  ... \n#nifty\xe2\x80\xa6',kotakbank weekly chart demand supply zone bulls bears breakout this time bulls keep nifty,0.0,0.0,0.0
2023-05-28 12:39:41,b'#kotakbank weekly chart demand supply zone for bulls &amp; bears can we see breakout this time by bulls keep eye  ...\xe2\x80\xa6 https://t.co/uRbqvoHKEh',kotakbank weekly chart demand supply zone bulls bears breakout this time bulls keep https uRbqvoHKEh,0.0,0.0,0.0
2023-05-28 09:37:19,b'@KotakBank__01 Hi!. Do not interact with anyone posing as a bank employee and do not share any personal details lik\xe2\x80\xa6 https://t.co/L1OasRHtXa',interact with anyone posing bank employee share personal details https OasRHtXa,0.0,0.3,0.0
2023-05-28 08:00:34,b'Anybody willing to join with tight SL on kotakBank https://t.co/ULUOuf5tj9',Anybody willing join with tight kotakBank https ULUOuf,0.03571428571428571,0.5178571428571428,0.01849489795918367
2023-05-28 07:19:52,b'https://t.co/FyimzSGTNw\n#KOTAKBANK READY TO MOVE',https FyimzSGTNw KOTAKBANK READY MOVE,0.2,0.5,0.1
2023-05-28 05:21:36,b'RT @NiveshakBharat: Some Key Charts which can help Index Traders to plan their FAVORABLE RR Trades coming WEEK\n\n(MAY 29th- JUNE 2nd)\n\n#BANK\xe2\x80\xa6',Some Charts which help Index Traders plan their FAVORABLE Trades coming WEEK JUNE BANK,0.0,0.0,0.0
2023-05-28 05:03:02,b'RT @Addition_Singh: #Kotakbank cmp 1945 \n\nretesting done  1900 \n5th time near resistance and spending time\n\n2120 we could see fast now\nSupp\xe2\x80\xa6',Kotakbank nretesting done time near resistance spending time could fast nSupp,0.15000000000000002,0.5,0.07500000000000001
2023-05-28 04:20:44,b'RT @NiveshakBharat: Some Key Charts which can help Index Traders to plan their FAVORABLE RR Trades coming WEEK\n\n(MAY 29th- JUNE 2nd)\n\n#BANK\xe2\x80\xa6',Some Charts which help Index Traders plan their FAVORABLE Trades coming WEEK JUNE BANK,0.0,0.0,0.0
2023-05-28 04:08:43,b'RT @Addition_Singh: #Kotakbank cmp 1945 \n\nretesting done  1900 \n5th time near resistance and spending time\n\n2120 we could see fast now\nSupp\xe2\x80\xa6',Kotakbank nretesting done time near resistance spending time could fast nSupp,0.15000000000000002,0.5,0.07500000000000001
2023-05-28 04:06:08,b'RT @NiveshakBharat: Some Key Charts which can help Index Traders to plan their FAVORABLE RR Trades coming WEEK\n\n(MAY 29th- JUNE 2nd)\n\n#BANK\xe2\x80\xa6',Some Charts which help Index Traders plan their FAVORABLE Trades coming WEEK JUNE BANK,0.0,0.0,0.0
2023-05-28 03:54:44,b'Some Key Charts which can help Index Traders to plan their FAVORABLE RR Trades coming WEEK\n\n(MAY 29th- JUNE 2nd)\xe2\x80\xa6 https://t.co/iENKurK6r0',Some Charts which help Index Traders plan their FAVORABLE Trades coming WEEK JUNE https iENKurK,0.0,0.0,0.0
2023-05-28 01:13:56,b'RT @Addition_Singh: #Kotakbank cmp 1945 \n\nretesting done  1900 \n5th time near resistance and spending time\n\n2120 we could see fast now\nSupp\xe2\x80\xa6',Kotakbank nretesting done time near resistance spending time could fast nSupp,0.15000000000000002,0.5,0.07500000000000001
2023-05-27 21:46:01,b'#KotakMahindraBank $KOTAKBANK Daily #Stock Chart with 20 days #Fibonacci Retracement Levels\nFibonacci #Support Leve\xe2\x80\xa6 https://t.co/DqWD6roaC3',KotakMahindraBank KOTAKBANK Daily Stock Chart with days Fibonacci Retracement Levels nFibonacci Support Leve https DqWD roaC,0.0,0.0,0.0
2023-05-27 19:22:27,"b'#OptionChain - #KOTAKBANK\n#Stock #Bearish\n#PCR :0.85\nMax #CE buildup at 2100,windup at 1460 #PE buildup at 1940 win\xe2\x80\xa6 https://t.co/9fDucozHjc'",OptionChain KOTAKBANK Stock Bearish nMax buildup windup buildup https fDucozHjc,0.0,0.0,0.0
2023-05-27 14:22:04,b'RT @Jkmodani: @myaccessbank @access_more we need your immediate attention &amp; reply DM to me in the long pending payment of I-LC issued by yo\xe2\x80\xa6',need your immediate attention reply long pending payment issued,-0.05,0.4,-0.020000000000000004
2023-05-27 14:05:12,b'@myaccessbank @access_more we need your immediate attention &amp; reply DM to me in the long pending payment of I-LC is\xe2\x80\xa6 https://t.co/9x5SRgMqMu',need your immediate attention reply long pending payment https SRgMqMu,-0.05,0.4,-0.020000000000000004
2023-05-27 12:48:05,"b'RT @5paisa: A snapshot of the top 5 stocks in each industry segment. \n\nFor more such #TradeBytes, stay tuned with 5paisa.\n\n#Tradebyte #SBI\xe2\x80\xa6'",snapshot stocks each industry segment nFor more such TradeBytes stay tuned with paisa Tradebyte,0.25,0.5,0.125
2023-05-27 12:31:03,b'RT @Addition_Singh: #Kotakbank cmp 1945 \n\nretesting done  1900 \n5th time near resistance and spending time\n\n2120 we could see fast now\nSupp\xe2\x80\xa6',Kotakbank nretesting done time near resistance spending time could fast nSupp,0.15000000000000002,0.5,0.07500000000000001
2023-05-27 12:27:53,b'RT @Addition_Singh: #Kotakbank cmp 1945 \n\nretesting done  1900 \n5th time near resistance and spending time\n\n2120 we could see fast now\nSupp\xe2\x80\xa6',Kotakbank nretesting done time near resistance spending time could fast nSupp,0.15000000000000002,0.5,0.07500000000000001
2023-05-27 12:26:18,b'#Kotakbank cmp 1945 \n\nretesting done  1900 \n5th time near resistance and spending time\n\n2120 we could see fast now\xe2\x80\xa6 https://t.co/HFWGstiO5Y',Kotakbank nretesting done time near resistance spending time could fast https HFWGstiO,0.15000000000000002,0.5,0.07500000000000001
2023-05-27 11:28:27,"b'@KotakBankLtd What a joke, only #KOTAKBANK is charging #Creditcard  limit enhancement fee. It is allowed ? @RBI\xe2\x80\xa6 https://t.co/YWpP8oP0wC'",What joke only KOTAKBANK charging Creditcard limit enhancement allowed https YWpP,0.0,1.0,0.0
2023-05-27 11:19:08,"b'@KotakBankLtd Your link it self is not working, just check . #KOTAKBANK.'",Your link self working just check KOTAKBANK,0.0,0.0,0.0
2023-05-27 11:08:29,b'@KotakBank__01 Hi!. Do not interact with anyone posing as a bank employee and do not share any personal details lik\xe2\x80\xa6 https://t.co/71N9gFaRUD',interact with anyone posing bank employee share personal details https gFaRUD,0.0,0.3,0.0
2023-05-27 09:53:29,b'@KotakBank__01 No response this no.',response this,0.0,0.0,0.0
2023-05-27 09:38:06,"b'#KotakMahindraBank $KOTAKBANK chart suggests #Fibonacci based #Resistance Levels are 1944.97,1946.7,1946.96\nand\xe2\x80\xa6 https://t.co/inVzD0PJ9v'",KotakMahindraBank KOTAKBANK chart suggests Fibonacci based Resistance Levels nand https inVzD,0.0,0.0,0.0
2023-05-27 09:38:06,b'#KotakMahindraBank $KOTAKBANK 5MinuteChart-SMAandFibonacciSupport-Resistance\nStock trading above 200 #SMA\n20SMA at\xe2\x80\xa6 https://t.co/nigW61Yegw',KotakMahindraBank KOTAKBANK MinuteChart SMAandFibonacciSupport Resistance nStock trading above https nigW Yegw,0.0,0.1,0.0
2023-05-27 09:07:09,b'#KotakMahindraBank $KOTAKBANK Last 6 months Daily #StockMovement Line #Chart\nMax downward movement was -2.1%\nMax up\xe2\x80\xa6 https://t.co/d9aKXXuKxN',KotakMahindraBank KOTAKBANK Last months Daily StockMovement Line Chart nMax downward movement nMax https aKXXuKxN,0.0,0.03333333333333333,0.0
2023-05-27 07:53:54,b'@KotakBank__01 Hi!. Do not interact with anyone posing as a bank employee and do not share any personal details lik\xe2\x80\xa6 https://t.co/5dhJx8VlQq',interact with anyone posing bank employee share personal details https dhJx VlQq,0.0,0.3,0.0
2023-05-27 07:53:49,b'@KotakBank__01 Hi!. Do not interact with anyone posing as a bank employee and do not share any personal details lik\xe2\x80\xa6 https://t.co/hUHDD70fDi',interact with anyone posing bank employee share personal details https hUHDD,0.0,0.3,0.0
2023-05-27 07:53:46,b'@KotakBank__01 Hi!. Do not interact with anyone posing as a bank employee and do not share any personal details lik\xe2\x80\xa6 https://t.co/3mEVJOFjHu',interact with anyone posing bank employee share personal details https mEVJOFjHu,0.0,0.3,0.0
2023-05-27 07:53:42,b'@KotakBank__01 Hi!. Do not interact with anyone posing as a bank employee and do not share any personal details lik\xe2\x80\xa6 https://t.co/EQxqyke2sa',interact with anyone posing bank employee share personal details https EQxqyke,0.0,0.3,0.0
2023-05-27 07:53:38,b'@KotakBank__01 Hi!. Do not interact with anyone posing as a bank employee and do not share any personal details lik\xe2\x80\xa6 https://t.co/urwAOUxk3l',interact with anyone posing bank employee share personal details https urwAOUxk,0.0,0.3,0.0
2023-05-27 07:53:34,b'@KotakBank__01 Hi!. Do not interact with anyone posing as a bank employee and do not share any personal details lik\xe2\x80\xa6 https://t.co/opz6PIvTjD',interact with anyone posing bank employee share personal details https PIvTjD,0.0,0.3,0.0
2023-05-27 07:53:30,b'@KotakBank__01 Hi!. Do not interact with anyone posing as a bank employee and do not share any personal details lik\xe2\x80\xa6 https://t.co/BTiFPpaVDm',interact with anyone posing bank employee share personal details https BTiFPpaVDm,0.0,0.3,0.0
2023-05-27 07:53:27,b'@KotakBank__01 Hi!. Do not interact with anyone posing as a bank employee and do not share any personal details lik\xe2\x80\xa6 https://t.co/u9dFbMwFt1',interact with anyone posing bank employee share personal details https dFbMwFt,0.0,0.3,0.0
2023-05-27 07:53:23,b'@KotakBank__01 Hi!. Do not interact with anyone posing as a bank employee and do not share any personal details lik\xe2\x80\xa6 https://t.co/FBuvom6hQb',interact with anyone posing bank employee share personal details https FBuvom,0.0,0.3,0.0
2023-05-27 07:53:19,b'@KotakBank__01 Hi!. Do not interact with anyone posing as a bank employee and do not share any personal details lik\xe2\x80\xa6 https://t.co/5Yf9s5Rc7f',interact with anyone posing bank employee share personal details https,0.0,0.3,0.0
2023-05-27 07:53:12,b'@KotakBank__01 Hi!. Do not interact with anyone posing as a bank employee and do not share any personal details lik\xe2\x80\xa6 https://t.co/6x4cDHcssC',interact with anyone posing bank employee share personal details https cDHcssC,0.0,0.3,0.0
2023-05-27 07:53:08,b'@KotakBank__01 Hi!. Do not interact with anyone posing as a bank employee and do not share any personal details lik\xe2\x80\xa6 https://t.co/w64C41NxyZ',interact with anyone posing bank employee share personal details https NxyZ,0.0,0.3,0.0
2023-05-27 07:53:05,b'@KotakBank__01 Hi!. Do not interact with anyone posing as a bank employee and do not share any personal details lik\xe2\x80\xa6 https://t.co/tywjJHx5ir',interact with anyone posing bank employee share personal details https tywjJHx,0.0,0.3,0.0
2023-05-27 07:52:55,b'@KotakBank__01 Hi!. Do not interact with anyone posing as a bank employee and do not share any personal details lik\xe2\x80\xa6 https://t.co/u5PGuW7dS6',interact with anyone posing bank employee share personal details https PGuW,0.0,0.3,0.0
2023-05-27 07:52:49,b'@KotakBank__01 Hi!. Do not interact with anyone posing as a bank employee and do not share any personal details lik\xe2\x80\xa6 https://t.co/uT7xIZUoyG',interact with anyone posing bank employee share personal details https xIZUoyG,0.0,0.3,0.0
2023-05-27 07:52:45,b'@KotakBank__01 Hi!. Do not interact with anyone posing as a bank employee and do not share any personal details lik\xe2\x80\xa6 https://t.co/JX4MgvJT6E',interact with anyone posing bank employee share personal details https MgvJT,0.0,0.3,0.0
2023-05-27 07:52:40,b'@KotakBank__01 Hi!. Do not interact with anyone posing as a bank employee and do not share any personal details lik\xe2\x80\xa6 https://t.co/lzt0Vs71aS',interact with anyone posing bank employee share personal details https,0.0,0.3,0.0
2023-05-27 07:52:37,b'@KotakBank__01 Hi!. Do not interact with anyone posing as a bank employee and do not share any personal details lik\xe2\x80\xa6 https://t.co/uwBgOMRg0D',interact with anyone posing bank employee share personal details https uwBgOMRg,0.0,0.3,0.0
2023-05-27 07:09:11,b'Stocks near 52 week high\n \xf0\x9f\x8c\x9f #DALBHARAT \xf0\x9f\x8c\x9f\n \xf0\x9f\x8c\x9f #ULTRACEMCO \xf0\x9f\x8c\x9f\n \xf0\x9f\x8c\x9f #TRENT \xf0\x9f\x8c\x9f\n \xf0\x9f\x8c\x9f #BEL \xf0\x9f\x8c\x9f\n \xf0\x9f\x8c\x9f #KOTAKBANK \xf0\x9f\x8c\x9f\n \xf0\x9f\x8c\x9f #OFSS \xf0\x9f\x8c\x9f\n \xf0\x9f\x8c\x9f\xe2\x80\xa6 https://t.co/BatyQwtcpT',Stocks near week high DALBHARAT ULTRACEMCO TRENT KOTAKBANK OFSS https BatyQwtcpT,0.13,0.47,0.0611
2023-05-27 06:12:38,"b'#KotakMahindraBank $KOTAKBANK chart suggests #Fibonacci based #Resistance Levels are 1945.62,1958.76,1960.74\nand\xe2\x80\xa6 https://t.co/TStqsXWv9H'",KotakMahindraBank KOTAKBANK chart suggests Fibonacci based Resistance Levels nand https TStqsXWv,0.0,0.0,0.0
